[
  {
    "id": "00000000-0000-4000-8000-000000000030",
    "instrument_ids": [
      "00000000-0000-4000-8000-000000000010"
    ],
    "event_type": "guidance",
    "cutoff": "2026-09-25T12:00:00Z",
    "packet_hash": "sha256:aaaaaaaaaaaaaaaaaaaaaaaaaaaaaaaaaaaaaaaaaaaaaaaaaaaaaaaaaaaaaaaa",
    "evidence_ids": [
      "ev-1"
    ],
    "claim_ids": [
      "cl-1"
    ],
    "coverage_gaps": [
      "no_consensus_estimates"
    ]
  }
]
