{
  "id": "00000000-0000-4000-8000-000000000504",
  "instrument_ids": [
    "00000000-0000-4000-8000-000000000004"
  ],
  "event_type": "regulatory",
  "cutoff": "2026-09-25T21:00:00Z",
  "packet_hash": "sha256:b1bfc838daaa3773310986b16876b2c3a9b91efa9579577798dc08320ffe2c9f",
  "evidence_ids": [
    "ev-1"
  ],
  "claim_ids": [
    "claim-1"
  ],
  "coverage_gaps": []
}
