{
  "id": "00000000-0000-4000-8000-000000000502",
  "instrument_ids": [
    "00000000-0000-4000-8000-000000000002"
  ],
  "event_type": "corporate_action",
  "cutoff": "2026-09-25T21:00:00Z",
  "packet_hash": "sha256:9874571d91b86b9d27d73220588904b1b51fc3681cebf3a24b14526492ef9d35",
  "evidence_ids": [
    "ev-1"
  ],
  "claim_ids": [
    "claim-1"
  ],
  "coverage_gaps": []
}
