{
  "id": "00000000-0000-4000-8000-000000000506",
  "instrument_ids": [
    "00000000-0000-4000-8000-000000000006"
  ],
  "event_type": "guidance",
  "cutoff": "2026-09-25T21:00:00Z",
  "packet_hash": "sha256:75a93bd2d78a1af489af5792319b47dca972b63922882b1438c6c6daed86eac2",
  "evidence_ids": [
    "ev-1",
    "ev-2"
  ],
  "claim_ids": [
    "claim-1",
    "claim-2"
  ],
  "coverage_gaps": []
}
