{
  "id": "00000000-0000-4000-8000-000000000503",
  "instrument_ids": [
    "00000000-0000-4000-8000-000000000003"
  ],
  "event_type": "other",
  "cutoff": "2026-09-25T21:00:00Z",
  "packet_hash": "sha256:8bcfaecc818e4ecaea036b8c03e70d7b7f25ea39b38370c10cbdb0d81867ac17",
  "evidence_ids": [
    "ev-1",
    "ev-2",
    "ev-3",
    "ev-4",
    "ev-5",
    "ev-6",
    "ev-7",
    "ev-8",
    "ev-9",
    "ev-10"
  ],
  "claim_ids": [
    "claim-1",
    "claim-2",
    "claim-3",
    "claim-4",
    "claim-5",
    "claim-6",
    "claim-7",
    "claim-8",
    "claim-9",
    "claim-10"
  ],
  "coverage_gaps": []
}
